{
  "moduleId": "dotnet-06-configuration-and-options",
  "title": "Configuration and options — concept map",
  "intro": "ASP.NET Core configuration merges key-value settings from JSON files, environment variables, user secrets, and cloud vaults into IConfiguration. The options pattern binds sections to strongly typed classes injected via IOptions, IOptionsSnapshot, or IOptionsMonitor. Later providers override earlier ones. Production APIs validate at startup, store secrets in Key Vault or K8s secrets, and use IOptionsMonitor for hot-reloaded feature flags.",
  "overviewDiagram": {
    "type": "mermaid",
    "title": "Configuration to options pipeline",
    "source": "flowchart TD\n  JSON[appsettings.json] --> MERGE[IConfiguration merge]\n  ENVJSON[appsettings.Environment.json] --> MERGE\n  SECRETS[User secrets / Key Vault / K8s env] --> MERGE\n  ENV[Environment variables __] --> MERGE\n  CLI[Command line] --> MERGE\n  MERGE --> BIND[Bind / Configure T]\n  BIND --> VAL[ValidateOnStart]\n  VAL --> OPT{Options interface}\n  OPT --> IO[IOptions static]\n  OPT --> SNAP[IOptionsSnapshot per request]\n  OPT --> MON[IOptionsMonitor hot reload]"
  },
  "conceptCards": [
    {
      "id": "card-providers",
      "title": "Configuration providers",
      "summary": "Pluggable sources merge into IConfiguration. Default chain: JSON → env JSON → user secrets → env vars → CLI. Last wins. Env vars use __ for :.",
      "example": "ConnectionStrings__OrdersDb overrides appsettings",
      "topicSlug": "configuration-providers"
    },
    {
      "id": "card-appsettings",
      "title": "appsettings layering",
      "summary": "Base appsettings.json plus appsettings.{Environment}.json overlay selected by ASPNETCORE_ENVIRONMENT. Defaults to Production if unset.",
      "example": "Development enables Debug logging override",
      "topicSlug": "appsettings-environments"
    },
    {
      "id": "card-options",
      "title": "Options pattern",
      "summary": "Configure<T> binds section to POCO. IOptions cached singleton. IOptionsSnapshot scoped per request. IOptionsMonitor CurrentValue + OnChange for reload.",
      "example": "IOptionsMonitor<FeatureFlags> in singleton service",
      "topicSlug": "options-pattern"
    },
    {
      "id": "card-binding",
      "title": "Configuration binding",
      "summary": "Get<T> and Bind map keys to properties. DataAnnotations + IValidateOptions<T>. ValidateOnStart fails host before traffic.",
      "example": "AddOptions<JwtOptions>().ValidateDataAnnotations().ValidateOnStart()",
      "topicSlug": "configuration-binding"
    },
    {
      "id": "card-secrets",
      "title": "Secrets management",
      "summary": "User secrets local dev only. K8s secrets as env vars in containers. Azure Key Vault with managed identity in production.",
      "example": "dotnet user-secrets set Jwt:SigningKey ...",
      "topicSlug": "secrets-and-keyvault"
    },
    {
      "id": "card-hotreload",
      "title": "Hot-reload config",
      "summary": "reloadOnChange on JSON providers. IOptionsMonitor.OnChange updates singletons. Feature flags yes; connection strings usually need restart.",
      "example": "monitor.OnChange(flags => _current = flags)",
      "topicSlug": "hot-reload-config"
    }
  ],
  "revisionDiagram": {
    "type": "mermaid",
    "title": "Configuration module revision map",
    "source": "mindmap\n  root((Configuration and Options))\n    Providers\n      JSON env CLI\n      Last provider wins\n      Env var __ naming\n      GetDebugView debug\n    appsettings Layering\n      Base plus Environment file\n      ASPNETCORE_ENVIRONMENT\n      Defaults Production\n      launchSettings local only\n    Options Pattern\n      IOptions singleton static\n      IOptionsSnapshot per request\n      IOptionsMonitor OnChange\n      Feature flags Monitor\n    Binding Validation\n      Get T Bind Configure\n      DataAnnotations\n      IValidateOptions T\n      ValidateOnStart fail fast\n    Secrets Production\n      User secrets dev only\n      K8s secrets env vars\n      Key Vault managed identity\n      Never commit passwords\n    Hot Reload\n      reloadOnChange JSON\n      IChangeToken fires\n      OnChange thread safe\n      DbContext URL restart\n    Express Compare\n      dotenv vs user secrets\n      process.env vs IConfiguration\n      NestJS ConfigService vs IOptions family"
  }
}
