{
  "moduleId": "dotnet-02-http-and-rest-apis",
  "title": "HTTP, REST, and API design fundamentals",
  "intro": "This module builds the vocabulary every Web API interview assumes: how HTTP messages flow through ASP.NET Core, how REST names resources, which status codes to return honestly, how to version without breaking clients, how OpenAPI documents contracts, and how idempotency keys plus cache headers keep APIs correct under retries and cheap under read load.",
  "overviewDiagram": {
    "type": "mermaid",
    "title": "From HTTP wire format to API contract",
    "source": "flowchart TB\n  H[HTTP request/response] --> R[REST resource design]\n  R --> M[Methods and status codes]\n  M --> V[API versioning]\n  V --> O[OpenAPI contract]\n  O --> I[Idempotency and caching]\n  H --> K[Kestrel HttpContext]\n  I --> P[Production: Redis keys ETags CDN]"
  },
  "conceptCards": [
    {
      "id": "http",
      "title": "HTTP fundamentals",
      "summary": "Request = method + URL + headers + body. Response = status + headers + body. ASP.NET Core exposes one HttpContext per exchange through Kestrel.",
      "example": "GET /api/orders?status=open with Authorization and X-Correlation-Id headers",
      "topicSlug": "http-fundamentals"
    },
    {
      "id": "rest",
      "title": "REST principles",
      "summary": "Resources are nouns in URLs. HTTP methods are verbs. Servers are stateless — auth rides on every request.",
      "example": "POST /api/orders → 201 Created with Location header, not POST /createOrder",
      "topicSlug": "rest-principles"
    },
    {
      "id": "status",
      "title": "Methods and status codes",
      "summary": "Safe GET, idempotent PUT/DELETE, non-idempotent POST. Use 4xx for client faults, 5xx for server faults — never hide errors in 200 bodies.",
      "example": "409 Conflict for duplicate idempotency key; 422 for declined payment",
      "topicSlug": "http-methods-status-codes"
    },
    {
      "id": "version",
      "title": "API versioning",
      "summary": "URL, header, or query strategies each trade visibility vs cache behavior. Ship v2 alongside v1; sunset with metrics.",
      "example": "/api/v2/orders with api-version: 2.0 header fallback",
      "topicSlug": "api-versioning"
    },
    {
      "id": "openapi",
      "title": "OpenAPI and Swagger",
      "summary": "Machine-readable contract for docs, client generation, and CI diff. Document all status codes including 4xx.",
      "example": "ProducesResponseType(409) + Swagger UI Bearer JWT scheme",
      "topicSlug": "openapi-swagger"
    },
    {
      "id": "idempotency",
      "title": "Idempotency and caching",
      "summary": "Idempotency-Key prevents duplicate charges on retry. ETags enable 304. Cache-Control directs browsers and CDNs.",
      "example": "Redis idempotency:abc → replay 201; ETag RowVersion → 304 Not Modified",
      "topicSlug": "idempotency-and-caching-headers"
    }
  ],
  "revisionDiagram": {
    "type": "mermaid",
    "title": "Module 02 concept map",
    "source": "mindmap\n  root((HTTP and REST APIs))\n    HTTP fundamentals\n      Request method URL headers body\n      HttpContext per request\n      Kestrel HTTP/2 multiplexing\n      Correlation ID propagation\n    REST principles\n      Nouns not verbs in URLs\n      Stateless server\n      Plural collections\n      201 Location on create\n    Methods and status codes\n      GET safe POST create\n      PUT idempotent replace\n      401 vs 403 vs 404\n      409 conflict 422 business rule\n      Problem Details RFC 7807\n    API versioning\n      URL segment v2\n      Header api-version\n      Query cache pitfalls\n      Sunset deprecation metrics\n    OpenAPI Swagger\n      Contract first vs code first\n      ProducesResponseType errors\n      Kiota NSwag clients\n      CI spec diff\n    Idempotency caching\n      Idempotency-Key Redis TTL\n      409 body hash mismatch\n      ETag If-None-Match 304\n      Cache-Control public private\n      Output cache server side"
  }
}
