{
  "moduleId": "javascript-07-null-undefined-optional",
  "title": "null, undefined, and optional access — concept map",
  "intro": "Two absence values, optional chaining, nullish coalescing, defensive guards at JSON boundaries, and how TypeScript strictNullChecks and C# NRT compare to run-time JavaScript.",
  "overviewDiagram": {
    "type": "mermaid",
    "title": "Null safety learning path",
    "source": "flowchart LR\n  A[null vs undefined] --> B[Optional chaining ?.]\n  B --> C[Nullish coalescing ??]\n  C --> D[Defensive guards]\n  D --> E[TS strictNullChecks vs JS runtime]"
  },
  "conceptCards": [
    {
      "id": "card-null-vs-undefined",
      "title": "null vs undefined",
      "summary": "undefined = unset default; null = intentional empty. typeof null is object. JSON omits undefined, keeps null.",
      "example": "value == null catches both",
      "topicSlug": "null-vs-undefined"
    },
    {
      "id": "card-optional-chaining",
      "title": "Optional chaining",
      "summary": "?. short-circuits on nullish base — property, index, or call. Does not validate shape.",
      "example": "user?.profile?.email",
      "topicSlug": "optional-chaining"
    },
    {
      "id": "card-nullish-coalescing",
      "title": "?? vs ||",
      "summary": "?? only null/undefined; || any falsy. Preserves 0 and empty string.",
      "example": "port ?? 3000 keeps port 0",
      "topicSlug": "nullish-coalescing"
    },
    {
      "id": "card-defensive",
      "title": "Guard clauses",
      "summary": "Validate JSON.parse at boundary. ?. for optional nested only. Fail fast with typed errors.",
      "example": "if (order == null) return",
      "topicSlug": "defensive-coding-patterns"
    },
    {
      "id": "card-nrt",
      "title": "Compile vs runtime",
      "summary": "TS/C# catch null at compile; JS needs runtime guards. Types erase — JSON never saw compiler.",
      "example": "requireString(raw.id, \"id\")",
      "topicSlug": "null-safety-vs-typescript-nrt"
    }
  ],
  "revisionDiagram": {
    "type": "mermaid",
    "title": "Null and optional access revision",
    "source": "mindmap\n  root((Null Safety))\n    null undefined\n      typeof null object\n      JSON null vs omit\n      default params undefined only\n    Optional access\n      dot chain ?.\n      bracket ?.\n      call ?.\n    Defaults\n      ?? nullish\n      || falsy trap\n      ??= assignment\n    Defense\n      guard clauses\n      JSON validation\n      fail fast TypeError\n    Static comparison\n      TS strictNullChecks\n      C# NRT warnings\n      runtime still JS"
  }
}
