{
  "moduleId": "csharp-07-null-safety",
  "title": "Null safety mind map",
  "intro": "Null in C# is two stories told with the same `?` symbol. On value types like `int`, the question mark wraps the value in a real struct (`Nullable<T>`). On reference types like `string`, it is a compiler annotation that warns you before run time — but null references still exist at run time. This module teaches both machines, how to enable nullable reference types (NRT), when to use runtime guards instead of the null-forgiving operator `!`, and how this compares to TypeScript strictNullChecks.",
  "overviewDiagram": {
    "type": "mermaid",
    "title": "Two null systems in one language",
    "source": "flowchart TD\n  START[Null safety in C#] --> VAL[Nullable value types]\n  START --> REF[Nullable reference types NRT]\n  VAL --> HAS[HasValue / Value / ??]\n  REF --> PROJ[Nullable enable in project]\n  REF --> FLOW[Flow analysis and warnings]\n  START --> GUARD[Guards and operators]\n  GUARD --> THROW[ThrowIfNull runtime]\n  GUARD --> OPS[?. ?? is not null]\n  GUARD --> BANG[! compile-time only]\n  START --> ATTR[required and analysis attributes]\n  START --> TS[Compare with TypeScript strictNullChecks]"
  },
  "conceptCards": [
    {
      "id": "card-nullable-value-ref",
      "title": "Value vs reference ?",
      "summary": "int? is System.Nullable<int> at run time. string? is still System.String — the ? is a compiler annotation.",
      "example": "int? score = null; // HasValue is false",
      "topicSlug": "nullable-value-vs-reference"
    },
    {
      "id": "card-nrt-annotations",
      "title": "NRT annotations",
      "summary": "Enable <Nullable>enable</Nullable>. Annotate string vs string?. Compiler warns on CS8600-family mismatches.",
      "example": "if (json is not null) json.Length",
      "topicSlug": "nrt-annotations"
    },
    {
      "id": "card-forgiving-checks",
      "title": "Guards vs !",
      "summary": "ThrowIfNull throws and updates null-state. x! only suppresses warnings — zero run-time effect.",
      "example": "ArgumentNullException.ThrowIfNull(message);",
      "topicSlug": "null-forgiving-and-checks"
    },
    {
      "id": "card-required-attrs",
      "title": "required and attributes",
      "summary": "required forces initialization, not non-null. MaybeNull and NotNullWhen teach generic Try* contracts.",
      "example": "[NotNullWhen(true)] out string? token",
      "topicSlug": "required-and-null-attributes"
    },
    {
      "id": "card-nrt-ts",
      "title": "NRT vs strictNullChecks",
      "summary": "Both are compile-time. C# adds Nullable<T> struct and NullReferenceException. JSON and Redis are still untyped.",
      "example": "Deserialize<T>()! // same trust class as JSON.parse + as T",
      "topicSlug": "nrt-vs-typescript"
    }
  ],
  "revisionDiagram": {
    "type": "mermaid",
    "title": "Null safety concept map",
    "source": "mindmap\n  root((Null safety))\n    Value types\n      int? is Nullable struct\n      HasValue and Value\n      Lifted operators return null\n      Boxing null int? is null ref\n    Reference types NRT\n      string? is annotation only\n      Nullable enable in csproj\n      Flow analysis CS8600 family\n      is not null narrows state\n    Operators and guards\n      ?. and ?? short-circuit\n      ThrowIfNull runtime guard\n      Bang operator warning only\n    Contracts\n      required initialization\n      MaybeNull on generic Find\n      NotNullWhen on TryGet\n    Cross language\n      strictNullChecks cousin\n      No undefined in C#\n      Validate JSON Redis SQS edges"
  },
  "nodes": [
    {
      "id": "nrt-root",
      "label": "Null safety"
    },
    {
      "id": "nrt-value",
      "label": "Nullable value types (Nullable<T>)",
      "parentId": "nrt-root"
    },
    {
      "id": "nrt-ref",
      "label": "Nullable reference types (annotations)",
      "parentId": "nrt-root"
    },
    {
      "id": "nrt-context",
      "label": "#nullable / <Nullable>enable</Nullable>",
      "parentId": "nrt-ref"
    },
    {
      "id": "nrt-forgive",
      "label": "! vs ThrowIfNull vs ?.",
      "parentId": "nrt-root"
    },
    {
      "id": "nrt-attrs",
      "label": "required, MaybeNull, NotNull",
      "parentId": "nrt-root"
    },
    {
      "id": "nrt-ts",
      "label": "strictNullChecks is not CLR null",
      "parentId": "nrt-root"
    }
  ],
  "edges": [
    {
      "from": "nrt-root",
      "to": "nrt-value",
      "label": "runtime type"
    },
    {
      "from": "nrt-root",
      "to": "nrt-ref",
      "label": "compile-time"
    },
    {
      "from": "nrt-ref",
      "to": "nrt-context",
      "label": "warnings"
    },
    {
      "from": "nrt-root",
      "to": "nrt-forgive",
      "label": "guards"
    },
    {
      "from": "nrt-root",
      "to": "nrt-attrs",
      "label": "contracts"
    },
    {
      "from": "nrt-root",
      "to": "nrt-ts",
      "label": "JS/TS"
    }
  ]
}
