{
  "moduleId": "typescript-17-compiler-options-tooling",
  "title": "Compiler options, tooling, and project architecture — concept map",
  "intro": "strict family flags, isolatedModules, verbatimModuleSyntax, project references, ESLint type-aware rules, and CI typecheck pipelines.",
  "overviewDiagram": {
    "type": "mermaid",
    "title": "Compiler options, tooling, and project architecture overview",
    "source": "flowchart TD\n  M[Compiler options, tooling, and project architecture] --> T1[Topic 1]\n  M --> T2[Topic 2]\n  M --> T3[Topic 3]\n  T1 --> P[Practice + interview]"
  },
  "conceptCards": [
    {
      "id": "card-strict-compiler-flags",
      "title": "The strict flag family and what each option does",
      "summary": "Core ideas for The strict flag family and what each option does — see topic page for snippets and diagrams.",
      "example": "strict-compiler-flags",
      "topicSlug": "strict-compiler-flags"
    },
    {
      "id": "card-isolated-modules-verbatim",
      "title": "isolatedModules, verbatimModuleSyntax, and bundler emit",
      "summary": "Core ideas for isolatedModules, verbatimModuleSyntax, and bundler emit — see topic page for snippets and diagrams.",
      "example": "isolated-modules-verbatim",
      "topicSlug": "isolated-modules-verbatim"
    },
    {
      "id": "card-project-references",
      "title": "Project references and monorepo typecheck strategy",
      "summary": "Core ideas for Project references and monorepo typecheck strategy — see topic page for snippets and diagrams.",
      "example": "project-references",
      "topicSlug": "project-references"
    },
    {
      "id": "card-eslint-type-aware",
      "title": "ESLint type-aware rules and @typescript-eslint",
      "summary": "Core ideas for ESLint type-aware rules and @typescript-eslint — see topic page for snippets and diagrams.",
      "example": "eslint-type-aware",
      "topicSlug": "eslint-type-aware"
    },
    {
      "id": "card-ci-typecheck-pipelines",
      "title": "CI typecheck pipelines and incremental builds",
      "summary": "Core ideas for CI typecheck pipelines and incremental builds — see topic page for snippets and diagrams.",
      "example": "ci-typecheck-pipelines",
      "topicSlug": "ci-typecheck-pipelines"
    }
  ],
  "revisionDiagram": {
    "type": "mermaid",
    "title": "Compiler options, tooling, and project architecture revision map",
    "source": "mindmap\n  root((Compiler options, tooling, and project architecture))\n    strict_compiler_flags[The strict flag family and what each option does]\n    isolated_modules_verbatim[isolatedModules, verbatimModuleSyntax, and bundler emit]\n    project_references[Project references and monorepo typecheck strategy]\n    eslint_type_aware[ESLint type-aware rules and @typescript-eslint]\n    ci_typecheck_pipelines[CI typecheck pipelines and incremental builds]"
  }
}
