{
  "moduleId": "typescript-09-generics",
  "title": "Generics and constraints — concept map",
  "intro": "Generic functions, classes, interfaces, constraints, default type parameters, keyof, and variance basics.",
  "overviewDiagram": {
    "type": "mermaid",
    "title": "Generics and constraints overview",
    "source": "flowchart TD\n  M[Generics and constraints] --> T1[Topic 1]\n  M --> T2[Topic 2]\n  M --> T3[Topic 3]\n  T1 --> P[Practice + interview]"
  },
  "conceptCards": [
    {
      "id": "card-generic-functions-and-classes",
      "title": "Generic functions, classes, and interfaces",
      "summary": "Generic functions, classes, and interfaces is compile-time type manipulation — erased at run time but essential for safe APIs.",
      "example": "type Unwrap<T> = T extends Promise<infer U> ? U : T;",
      "topicSlug": "generic-functions-and-classes"
    },
    {
      "id": "card-generic-constraints",
      "title": "Generic constraints (extends) and keyof",
      "summary": "Generic constraints (extends) and keyof is compile-time type manipulation — erased at run time but essential for safe APIs.",
      "example": "type Unwrap<T> = T extends Promise<infer U> ? U : T;",
      "topicSlug": "generic-constraints"
    },
    {
      "id": "card-default-type-parameters",
      "title": "Default type parameters and inference",
      "summary": "Default type parameters and inference is compile-time type manipulation — erased at run time but essential for safe APIs.",
      "example": "type Unwrap<T> = T extends Promise<infer U> ? U : T;",
      "topicSlug": "default-type-parameters"
    },
    {
      "id": "card-generic-utility-wrappers",
      "title": "Generic Result, Option, and API wrapper patterns",
      "summary": "Generic Result, Option, and API wrapper patterns is compile-time type manipulation — erased at run time but essential for safe APIs.",
      "example": "type Unwrap<T> = T extends Promise<infer U> ? U : T;",
      "topicSlug": "generic-utility-wrappers"
    },
    {
      "id": "card-variance-basics",
      "title": "Variance basics: in, out, and assignability",
      "summary": "Variance basics: in, out, and assignability is compile-time type manipulation — erased at run time but essential for safe APIs.",
      "example": "type Unwrap<T> = T extends Promise<infer U> ? U : T;",
      "topicSlug": "variance-basics"
    }
  ],
  "revisionDiagram": {
    "type": "mermaid",
    "title": "Generics and constraints revision map",
    "source": "mindmap\n  root((Generics and constraints))\n    generic_functions_and_classes[Generic functions, classes, and interfaces]\n    generic_constraints[Generic constraints (extends) and keyof]\n    default_type_parameters[Default type parameters and inference]\n    generic_utility_wrappers[Generic Result, Option, and API wrapper patterns]\n    variance_basics[Variance basics: in, out, and assignability]"
  }
}
