{
  "moduleId": "javascript-09-structural-typing-patterns",
  "title": "Structural typing and duck typing patterns — concept map",
  "intro": "Duck typing, shape checks, branding patterns, nominal versus structural typing, and how JavaScript patterns foreshadow TypeScript interfaces.",
  "overviewDiagram": {
    "type": "mermaid",
    "title": "Structural typing and duck typing patterns overview",
    "source": "flowchart TD\n  M[Structural typing and duck typing patterns] --> T1[Topic 1]\n  M --> T2[Topic 2]\n  M --> T3[Topic 3]\n  T1 --> P[Practice + interview]"
  },
  "conceptCards": [
    {
      "id": "card-duck-typing",
      "title": "Duck typing and shape-based APIs",
      "summary": "Core ideas for Duck typing and shape-based APIs — see topic page for snippets and diagrams.",
      "example": "duck-typing",
      "topicSlug": "duck-typing"
    },
    {
      "id": "card-runtime-shape-validation",
      "title": "Runtime validation: typeof guards and schema libraries",
      "summary": "Core ideas for Runtime validation: typeof guards and schema libraries — see topic page for snippets and diagrams.",
      "example": "runtime-shape-validation",
      "topicSlug": "runtime-shape-validation"
    },
    {
      "id": "card-branding-and-symbols",
      "title": "Branding with Symbol and opaque types in JS",
      "summary": "Core ideas for Branding with Symbol and opaque types in JS — see topic page for snippets and diagrams.",
      "example": "branding-and-symbols",
      "topicSlug": "branding-and-symbols"
    },
    {
      "id": "card-nominal-vs-structural",
      "title": "Nominal (C#) versus structural (JS/TS) typing",
      "summary": "Core ideas for Nominal (C#) versus structural (JS/TS) typing — see topic page for snippets and diagrams.",
      "example": "nominal-vs-structural",
      "topicSlug": "nominal-vs-structural"
    },
    {
      "id": "card-factory-and-builder-patterns",
      "title": "Factory, builder, and object composition patterns",
      "summary": "Core ideas for Factory, builder, and object composition patterns — see topic page for snippets and diagrams.",
      "example": "factory-and-builder-patterns",
      "topicSlug": "factory-and-builder-patterns"
    }
  ],
  "revisionDiagram": {
    "type": "mermaid",
    "title": "Structural typing and duck typing patterns revision map",
    "source": "mindmap\n  root((Structural typing and duck typing patterns))\n    duck_typing[Duck typing and shape-based APIs]\n    runtime_shape_validation[Runtime validation: typeof guards and schema libraries]\n    branding_and_symbols[Branding with Symbol and opaque types in JS]\n    nominal_vs_structural[Nominal (C#) versus structural (JS/TS) typing]\n    factory_and_builder_patterns[Factory, builder, and object composition patterns]"
  }
}
