{
  "moduleId": "csharp-18-version-style-performance",
  "title": "Version, style, performance — concept map",
  "intro": "Synthesize C# 8 through C# 14 against modules you already studied, pin LangVersion without surprises, write idiomatic services, split domain from Data Transfer Object (DTO) with allocation in mind, and review code the way interviewers do.",
  "overviewDiagram": {
    "type": "mermaid",
    "title": "Capstone synthesis",
    "source": "flowchart TD\n  A[C# 8 to 14 map] --> B[LangVersion plus TFM]\n  B --> C[Idiomatic style]\n  C --> D[Domain vs DTO record]\n  D --> E[Code review radar]\n  E --> F[Modules 01 to 17 in practice]"
  },
  "conceptCards": [
    {
      "id": "card-map",
      "title": "C# 8–14 map",
      "summary": "Features tied to modules: NRT, records, patterns, spans, collection expressions.",
      "example": "record OrderDto plus IAsyncEnumerable pages",
      "topicSlug": "csharp-8-to-14-map"
    },
    {
      "id": "card-lang",
      "title": "LangVersion and TFM",
      "summary": "Syntax vs API surface. Upgrade TFM first. Nullable incremental. CI public API.",
      "example": "Directory.Build.props pins net10.0 and LangVersion 14",
      "topicSlug": "langversion-breaking-changes"
    },
    {
      "id": "card-idiom",
      "title": "Idiomatic C#",
      "summary": "async I/O, sealed, guard clauses, patterns, BCL naming.",
      "example": "public sealed class OrderService(IRepo repo)",
      "topicSlug": "idiomatic-csharp"
    },
    {
      "id": "card-dto",
      "title": "Domain vs DTO",
      "summary": "Behavior in domain. record DTO at boundary. record struct for CSV hot path.",
      "example": "CsvRow record struct from span parse",
      "topicSlug": "domain-dto-record"
    },
    {
      "id": "card-radar",
      "title": "Review radar",
      "summary": "Flag Result, lock across I/O, ToList in loop, null!, missing cancellation.",
      "example": "SQS handler must pass CancellationToken",
      "topicSlug": "code-review-radar"
    }
  ],
  "revisionDiagram": {
    "type": "mermaid",
    "title": "Version and style revision map",
    "source": "mindmap\n  root((Version style performance))\n    Feature map\n      C# 8 NRT patterns async enum\n      C# 9 records init\n      C# 10 11 12 13 14 incremental\n      Tie to module numbers\n    Versions\n      LangVersion syntax\n      TFM API surface\n      Nullable migrate incremental\n      Public API CI guards\n    Idiomatic\n      async all I/O path\n      sealed composition\n      guard clauses patterns\n      BCL naming style\n    DTO domain\n      DTO at HTTP cache edge\n      domain invariants inside\n      record struct bulk import\n      map once not thrice\n    Review radar\n      sync over async block\n      lock never across await\n      alloc loop concat ToList\n      nullable honest no bang"
  }
}
