{
  "moduleId": "aws-11-lambda-serverless",
  "title": "AWS Lambda and serverless compute patterns — concept map",
  "intro": "Lambda executes handlers in ephemeral sandboxes scaled by AWS. Cold starts initialize runtime; warm invocations reuse environment until frozen. VPC access creates ENIs. Triggers connect S3, API Gateway, SQS, EventBridge, and more. Concurrency caps and DLQs handle failure modes. Compare with long-running EC2 and containerized Fargate for sustained load.",
  "overviewDiagram": {
    "type": "mermaid",
    "title": "Lambda invoke path",
    "source": "flowchart LR\n  T[Trigger S3 API SQS] --> L[Lambda service]\n  L --> E[Execution environment]\n  E --> H[Handler code]\n  E --> VPC[VPC ENI optional]\n  H --> AWS[AWS SDK calls]\n  L --> DLQ[DLQ on async failure]"
  },
  "conceptCards": [
    {
      "id": "card-exec",
      "title": "Execution env",
      "summary": "Frozen container reuse; /tmp 512MB–10GB; state not guaranteed across invocations.",
      "example": "Reuse SDK client outside handler for warm perf",
      "topicSlug": "lambda-execution-environment"
    },
    {
      "id": "card-cold",
      "title": "Cold starts",
      "summary": "Init runtime + handler load. Provisioned concurrency keeps environments warm.",
      "example": "Java/.NET larger init than Node/Python",
      "topicSlug": "lambda-cold-starts"
    },
    {
      "id": "card-vpc",
      "title": "VPC Lambda",
      "summary": "Hyperplane ENIs in subnets for RDS access. Needs NAT or endpoints for AWS APIs.",
      "example": "/24 subnet sizing for peak concurrency",
      "topicSlug": "lambda-in-vpc"
    },
    {
      "id": "card-trig",
      "title": "Triggers",
      "summary": "Sync vs async invoke. Event source mappings poll SQS/Kinesis.",
      "example": "S3 ObjectCreated async with retry + DLQ",
      "topicSlug": "lambda-triggers"
    },
    {
      "id": "card-conc",
      "title": "Concurrency & DLQ",
      "summary": "Account and function reserved concurrency. Async failures to DLQ after retries.",
      "example": "Reserved concurrency=10 protects downstream DB",
      "topicSlug": "lambda-concurrency-dlq"
    },
    {
      "id": "card-compare",
      "title": "vs EC2/Fargate",
      "summary": "Lambda for event-driven burst; EC2/Fargate for steady TCP, long jobs, custom kernel.",
      "example": "WebSocket server on EC2 not Lambda",
      "topicSlug": "lambda-vs-ec2-fargate"
    }
  ],
  "revisionDiagram": {
    "type": "mermaid",
    "title": "Lambda revision map",
    "source": "mindmap\n  root((Lambda serverless))\n    Execution env\n      Sandbox reuse\n      Tmp storage\n      Init outside handler\n    Cold start\n      Provisioned concurrency\n      SnapStart Java\n      ARM Graviton2\n    VPC\n      ENI hyperplane\n      Endpoints vs NAT\n      Subnet IP planning\n    Triggers\n      Sync async\n      Event source mapping\n      S3 SQS EventBridge\n    Concurrency DLQ\n      Reserved limits\n      Throttling 429\n      Async retry DLQ\n    vs EC2 Fargate\n      Duration 15 min cap\n      WebSockets long lived\n      Fargate for containers"
  }
}
