{
  "moduleId": "typescript-01-what-is-typescript",
  "title": "What TypeScript is (compared to JavaScript and C#)",
  "intro": "TypeScript adds compile-time type checking on top of JavaScript — types erase before any engine runs your code. This module covers how TypeScript differs from JavaScript and C#, the tsc pipeline, tsconfig setup, erasable types, annotations, and gradual JavaScript interop.",
  "overviewDiagram": {
    "type": "mermaid",
    "title": "Module overview: from TypeScript source to running JavaScript",
    "source": "flowchart TD\n  A[Write .ts source] --> B[tsconfig.json rules]\n  B --> C[tsc type-check]\n  C --> D[Erase types + emit .js]\n  D --> E[Optional bundle]\n  E --> F[V8 / Browser runs JS]\n  G[C# path: IL + CLR] -.->|different host| F"
  },
  "conceptCards": [
    {
      "id": "card-ts-vs-js-csharp",
      "title": "TypeScript vs JavaScript vs C#",
      "summary": "JS runs in engines. TS checks then erases. C# keeps types in IL metadata enforced by the CLR.",
      "example": "JSON.parse in TS is as unsafe at run time as in JS unless you validate.",
      "topicSlug": "typescript-vs-javascript-csharp"
    },
    {
      "id": "card-compile-pipeline",
      "title": "Compile pipeline (tsc)",
      "summary": "Parse → type check → transform → emit .js, .d.ts, source maps. Often split: tsc --noEmit + bundler.",
      "example": "npx tsc --noEmit in CI; Vite emits for production",
      "topicSlug": "compile-pipeline-and-tsc"
    },
    {
      "id": "card-tsconfig",
      "title": "tsconfig and strict mode",
      "summary": "compilerOptions control strictness and emit. Project references scale monorepos with tsc -b.",
      "example": "strict: true + module: NodeNext for ESM libraries",
      "topicSlug": "tsconfig-and-project-setup"
    },
    {
      "id": "card-erasure",
      "title": "Erasable types",
      "summary": "Interfaces and generics vanish. Classes and enums emit JS. Validate at API boundaries.",
      "example": "import type { Order } — erased; class OrderService — emits",
      "topicSlug": "erasable-types-and-runtime"
    },
    {
      "id": "card-annotations",
      "title": "Annotations and inference",
      "summary": "Annotate exports; infer locals. unknown at boundaries, not any.",
      "example": "const ids = ['a']; infers string[] — export function needs explicit signature",
      "topicSlug": "type-annotations-basics"
    },
    {
      "id": "card-interop",
      "title": "JavaScript interop",
      "summary": "allowJs, .d.ts, @types/*, gradual migration. C# ↔ JS is service boundaries, not mixed files.",
      "example": "Legacy format.js + types/legacy-format.d.ts shim",
      "topicSlug": "javascript-interop"
    }
  ],
  "revisionDiagram": {
    "type": "mermaid",
    "title": "Revision map: what TypeScript is",
    "source": "mindmap\n  root((TypeScript))\n    vs JS and C#\n      Superset of JS\n      Types erase\n      CLR keeps metadata\n    Pipeline\n      tsc check\n      emit JavaScript\n      source maps\n      bundler optional\n    tsconfig\n      strict true\n      NodeNext ESM\n      project references\n    Erasure\n      interface gone\n      class emits\n      validate boundaries\n    Style\n      infer locals\n      annotate exports\n      unknown not any\n    Interop\n      allowJs migrate\n      d.ts for npm\n      OpenAPI with C#"
  }
}
