{
  "moduleId": "aws-17-cloud-foundation",
  "title": "Cloud foundation — concept map",
  "intro": "Cloud foundations use landing zones to govern multi-account AWS estates. Account vending, SCP guardrails, hub-spoke networking, Identity Center SSO, and centralized logging form the enterprise baseline from AWS Cloud Foundation prescriptive guidance.",
  "overviewDiagram": {
    "type": "mermaid",
    "title": "Foundation layers",
    "source": "flowchart TB\n  LZ[Landing Zone] --> OU[OU hierarchy]\n  LZ --> AV[Account vending]\n  LZ --> NET[Hub-spoke TGW]\n  LZ --> ID[Identity Center SSO]\n  LZ --> LOG[Centralized logging]"
  },
  "conceptCards": [
    {
      "id": "c-lz",
      "title": "Landing zone",
      "summary": "Multi-account foundation with baselines.",
      "example": "Control Tower with Workloads OU",
      "topicSlug": "landing-zone-concept"
    },
    {
      "id": "c-guard",
      "title": "Guardrails",
      "summary": "SCPs + vending + Config detective.",
      "example": "SCP deny unapproved regions",
      "topicSlug": "account-vending-guardrails"
    },
    {
      "id": "c-net",
      "title": "Hub-spoke",
      "summary": "TGW hub, IPAM CIDR, inspection VPC.",
      "example": "Spoke prod VPC via TGW",
      "topicSlug": "network-foundation-hub-spoke"
    },
    {
      "id": "c-id",
      "title": "Identity SSO",
      "summary": "IdP federation, permission sets.",
      "example": "Okta group → dev account role",
      "topicSlug": "identity-foundation-sso"
    },
    {
      "id": "c-log",
      "title": "Central logging",
      "summary": "Org CloudTrail, log-archive, SCP.",
      "example": "Athena who-deleted query",
      "topicSlug": "centralized-logging-baseline"
    }
  ],
  "revisionDiagram": {
    "type": "mermaid",
    "title": "Foundation revision map",
    "source": "mindmap\n  root((Cloud Foundation))\n    Landing zone\n      OU hierarchy\n      Management account\n      Shared services\n    Guardrails\n      SCP deny\n      Account Factory\n      Config detective\n    Networking\n      Hub spoke TGW\n      IPAM CIDR\n      Inspection VPC\n    Identity\n      Identity Center\n      Permission sets\n      IdP SAML\n    Logging\n      Org CloudTrail\n      Log archive\n      Object Lock SCP"
  }
}
