{
  "moduleId": "aws-03-accounts-identity-tenancy",
  "title": "Accounts, identity, and tenancy",
  "intro": "AWS security starts with account boundaries, organization guardrails, IAM roles and policies, SaaS tenant isolation patterns, and consistent tagging across environments.",
  "overviewDiagram": {
    "type": "mermaid",
    "title": "Identity and tenancy flow",
    "source": "flowchart TD\n  ACC[Account boundary] --> ORG[Organizations + SCPs]\n  ORG --> IAM[IAM roles and policies]\n  IAM --> TENANT[Multi-tenant isolation]\n  TENANT --> TAGS[Tags and environments]"
  },
  "conceptCards": [
    {
      "id": "card-account",
      "title": "Account boundary",
      "summary": "12-digit account ID is the hardest default isolation — separate prod from dev at account level.",
      "example": "AssumeRole with ExternalId for cross-account CI deploy.",
      "topicSlug": "aws-account-boundary"
    },
    {
      "id": "card-scp",
      "title": "Organizations and SCPs",
      "summary": "SCPs filter maximum permissions — deny guardrails on OUs, never grant.",
      "example": "Deny actions outside approved Regions.",
      "topicSlug": "organizations-and-scps"
    },
    {
      "id": "card-iam",
      "title": "IAM fundamentals",
      "summary": "Roles for services, SSO for humans. Explicit Deny wins. Least privilege with conditions.",
      "example": "Lambda execution role with s3:GetObject on one prefix.",
      "topicSlug": "iam-fundamentals"
    },
    {
      "id": "card-tenant",
      "title": "Multi-tenant isolation",
      "summary": "Silo, pool, or bridge — AWS provides boundaries; app enforces tenant_id everywhere.",
      "example": "DynamoDB partition key tenantId for pooled model.",
      "topicSlug": "multi-tenant-isolation-overview"
    },
    {
      "id": "card-tags",
      "title": "Tags and environments",
      "summary": "Tags for cost and automation; accounts for security. Enforce at resource creation.",
      "example": "SCP denies RunInstances without Environment tag.",
      "topicSlug": "tags-and-environments"
    }
  ],
  "revisionDiagram": {
    "type": "mermaid",
    "title": "Revision map: accounts and identity",
    "source": "mindmap\n  root((Identity and Tenancy))\n    Accounts\n      Hard isolation unit\n      Multi-account landing zone\n      Cross-account AssumeRole\n    Organizations\n      OUs and consolidated billing\n      SCP guardrails not grants\n      Tag policies\n    IAM\n      Roles vs users\n      Trust and permission policies\n      Deny beats Allow\n      STS temporary creds\n    SaaS tenancy\n      Silo pool bridge\n      tenant_id every query\n      ABAC and rate limits\n    Tags\n      Cost allocation\n      Not security boundary\n      aws:RequestTag conditions"
  }
}
