{
  "moduleId": "aws-05-vpc-fundamentals",
  "title": "VPC fundamentals — concept map",
  "intro": "A Virtual Private Cloud (VPC) is your isolated network in AWS. You carve Classless Inter-Domain Routing (CIDR) blocks into subnets per Availability Zone, attach an Internet Gateway for public ingress, and use NAT Gateway so private subnets reach the internet without inbound exposure. Route tables decide every packet hop. VPC DNS resolves internal names. Elastic IPs give stable public addresses; multi-AZ patterns tie it together for production.",
  "overviewDiagram": {
    "type": "mermaid",
    "title": "Standard multi-AZ VPC",
    "source": "flowchart TB\n  IGW[Internet Gateway]\n  subgraph VPC[\"VPC 10.0.0.0/16\"]\n    subgraph PubA[\"Public subnet AZ-a 10.0.1.0/24\"]\n      ALB[Application Load Balancer]\n      NAT[NAT Gateway]\n    end\n    subgraph PrivA[\"Private subnet AZ-a 10.0.10.0/24\"]\n      APP1[EC2 / ECS tasks]\n    end\n    subgraph PubB[\"Public subnet AZ-b 10.0.2.0/24\"]\n      NAT2[NAT Gateway]\n    end\n    subgraph PrivB[\"Private subnet AZ-b 10.0.20.0/24\"]\n      APP2[EC2 / ECS tasks]\n    end\n  end\n  Internet((Internet)) --> IGW\n  IGW --> ALB\n  IGW --> NAT\n  IGW --> NAT2\n  APP1 --> NAT\n  APP2 --> NAT2\n  NAT --> IGW\n  NAT2 --> IGW"
  },
  "conceptCards": [
    {
      "id": "card-cidr",
      "title": "CIDR & subnets",
      "summary": "Plan /16 VPC with /24 subnets per AZ. Public subnets have route to Internet Gateway; private subnets do not.",
      "example": "10.0.1.0/24 public AZ-a, 10.0.10.0/24 private AZ-a",
      "topicSlug": "aws-vpc-cidr-subnets"
    },
    {
      "id": "card-igw",
      "title": "Internet Gateway",
      "summary": "Horizontally scaled VPC edge for bidirectional internet. Required for public subnets and NAT egress path.",
      "example": "ALB in public subnet with 0.0.0.0/0 → igw-xxxx",
      "topicSlug": "aws-internet-gateway"
    },
    {
      "id": "card-nat",
      "title": "NAT Gateway",
      "summary": "Managed outbound-only internet from private subnets. Place in public subnet, one per AZ for HA.",
      "example": "Private EC2 pulls npm packages via NAT in same AZ",
      "topicSlug": "aws-nat-gateway"
    },
    {
      "id": "card-routes",
      "title": "Route tables",
      "summary": "Longest-prefix match decides next hop. Each subnet associates with exactly one route table.",
      "example": "Private RT: 0.0.0.0/0 → nat-xxx; 10.0.0.0/16 → local",
      "topicSlug": "aws-route-tables"
    },
    {
      "id": "card-dns",
      "title": "VPC DNS",
      "summary": "AmazonProvidedDNS at VPC CIDR+2 resolves internal hostnames and AWS service endpoints.",
      "example": "EnableDnsHostnames for public DNS names on instances with public IPs",
      "topicSlug": "aws-vpc-dns"
    },
    {
      "id": "card-eip",
      "title": "Elastic vs ephemeral IP",
      "summary": "Elastic IP persists across stop/start; ephemeral public IP changes unless Elastic IP associated.",
      "example": "NAT Gateway requires Elastic IP allocation in public subnet",
      "topicSlug": "aws-elastic-vs-ephemeral-ip"
    },
    {
      "id": "card-multi-az",
      "title": "Multi-AZ VPC patterns",
      "summary": "Mirror public/private subnets per AZ, NAT per AZ, ALB cross-zone, databases Multi-AZ.",
      "example": "Three AZs × (public + private) + three NAT Gateways",
      "topicSlug": "aws-multi-az-vpc-patterns"
    }
  ],
  "revisionDiagram": {
    "type": "mermaid",
    "title": "VPC fundamentals revision map",
    "source": "mindmap\n  root((VPC fundamentals))\n    CIDR planning\n      VPC /16 common\n      Subnet /24 per AZ\n      Reserve space for growth\n      Public vs private intent\n    Internet Gateway\n      Attach to VPC\n      Public subnet default route\n      Bidirectional NAT path\n    NAT Gateway\n      Outbound only from private\n      Lives in public subnet\n      One per AZ for HA\n      NAT instance legacy\n    Route tables\n      Subnet one RT association\n      Local route always\n      Longest prefix wins\n      Packet walkthrough\n    VPC DNS\n      AmazonProvidedDNS base+2\n      EnableDnsSupport Hostnames\n      Private hosted zones\n    Elastic IP\n      Stable public address\n      Ephemeral changes on stop\n      NAT requires EIP\n    Multi-AZ patterns\n      ALB spans AZs\n      App tier per AZ\n      RDS Multi-AZ\n      Avoid single NAT AZ failure"
  }
}
