{
  "moduleId": "typescript-07-null-safety-strict",
  "title": "Null safety and strictNullChecks — concept map",
  "intro": "strictNullChecks, optional properties, non-null assertion, definite assignment, and comparisons to C# NRT.",
  "overviewDiagram": {
    "type": "mermaid",
    "title": "Null safety and strictNullChecks overview",
    "source": "flowchart TD\n  M[Null safety and strictNullChecks] --> T1[Topic 1]\n  M --> T2[Topic 2]\n  M --> T3[Topic 3]\n  T1 --> P[Practice + interview]"
  },
  "conceptCards": [
    {
      "id": "card-strict-null-checks",
      "title": "strictNullChecks and the null safety model",
      "summary": "Core ideas for strictNullChecks and the null safety model — see topic page for snippets and diagrams.",
      "example": "strict-null-checks",
      "topicSlug": "strict-null-checks"
    },
    {
      "id": "card-optional-properties",
      "title": "Optional properties (?), undefined, and exactOptionalPropertyTypes",
      "summary": "Core ideas for Optional properties (?), undefined, and exactOptionalPropertyTypes — see topic page for snippets and diagrams.",
      "example": "optional-properties",
      "topicSlug": "optional-properties"
    },
    {
      "id": "card-non-null-assertion",
      "title": "Non-null assertion (!) and when it is dangerous",
      "summary": "Core ideas for Non-null assertion (!) and when it is dangerous — see topic page for snippets and diagrams.",
      "example": "non-null-assertion",
      "topicSlug": "non-null-assertion"
    },
    {
      "id": "card-definite-assignment",
      "title": "Definite assignment and strictPropertyInitialization",
      "summary": "Core ideas for Definite assignment and strictPropertyInitialization — see topic page for snippets and diagrams.",
      "example": "definite-assignment",
      "topicSlug": "definite-assignment"
    },
    {
      "id": "card-null-safety-vs-csharp-nrt",
      "title": "TypeScript null safety versus C# nullable reference types",
      "summary": "Core ideas for TypeScript null safety versus C# nullable reference types — see topic page for snippets and diagrams.",
      "example": "null-safety-vs-csharp-nrt",
      "topicSlug": "null-safety-vs-csharp-nrt"
    }
  ],
  "revisionDiagram": {
    "type": "mermaid",
    "title": "Null safety and strictNullChecks revision map",
    "source": "mindmap\n  root((Null safety and strictNullChecks))\n    strict_null_checks[strictNullChecks and the null safety model]\n    optional_properties[Optional properties (?), undefined, and exactOptionalPropertyTypes]\n    non_null_assertion[Non-null assertion (!) and when it is dangerous]\n    definite_assignment[Definite assignment and strictPropertyInitialization]\n    null_safety_vs_csharp_nrt[TypeScript null safety versus C# nullable reference types]"
  }
}
