{
  "moduleId": "csharp-03-type-system",
  "title": "Type system (language view)",
  "intro": "C# checks types before your program runs. Every variable has a fixed type — either written by you or inferred with `var`. This module teaches which built-in types to pick, how value and reference types copy or alias, how null and defaults work, and how to convert and test types safely.",
  "overviewDiagram": {
    "type": "mermaid",
    "title": "Type system learning path",
    "source": "flowchart LR\n  A[\"Declared types and var\"] --> B[\"Built-in types\"]\n  B --> C[\"Value vs reference\"]\n  C --> D[\"Defaults and assignment\"]\n  D --> E[\"null and nullable values\"]\n  E --> F[\"Conversions and tests\"]\n  F --> G[\"Custom type kinds\"]\n  G --> H[\"object, CTS, dynamic\"]"
  },
  "conceptCards": [
    {
      "id": "var-inference",
      "title": "var is type inference",
      "summary": "`var` asks the compiler to pick the type from the initializer. It is not JavaScript `var` and not `dynamic`.",
      "example": "`var count = 10;` → `int`, locked forever.",
      "topicSlug": "types-and-var"
    },
    {
      "id": "decimal-money",
      "title": "decimal for money and grades",
      "summary": "Use `decimal` (with `m` suffix) for currency and GPA. Use `double` for graphics and science math.",
      "example": "`decimal fee = 19.99m;`",
      "topicSlug": "built-in-types"
    },
    {
      "id": "copy-vs-alias",
      "title": "Copy vs alias",
      "summary": "Value types copy on assignment. Reference types alias the same object. Boxing wraps a value as `object`.",
      "example": "`list2 = list1` — both see the same list.",
      "topicSlug": "value-vs-reference"
    },
    {
      "id": "definite-assignment",
      "title": "Locals must be assigned",
      "summary": "Fields default to zero or null. Locals must be assigned on every path before read — or the build fails.",
      "example": "`int retry = default;` → 0",
      "topicSlug": "defaults-definite-assignment"
    },
    {
      "id": "nullable-int",
      "title": "int? for missing numbers",
      "summary": "`int?` is `Nullable<int>` — a struct that can report \"no value.\" Different from `string?` (module 07).",
      "example": "`int ttl = ttlSeconds ?? 60;`",
      "topicSlug": "null-and-nullable-values"
    },
    {
      "id": "is-as-typeof",
      "title": "is, as, typeof, GetType",
      "summary": "`typeof` is compile-time. `GetType()` is run-time. `is` tests compatibility; `as` returns null on failure.",
      "example": "`if (payload is string jwt) Validate(jwt);`",
      "topicSlug": "conversions"
    },
    {
      "id": "type-catalog",
      "title": "class, struct, record, enum",
      "summary": "Pick class for identity, struct for small copyable data, record for value equality, enum for fixed constants.",
      "example": "`record Student(string Name, decimal Gpa);`",
      "topicSlug": "custom-type-kinds"
    },
    {
      "id": "cts-dynamic",
      "title": "object root and dynamic",
      "summary": "Every type derives from `object` via the Common Type System (CTS). `dynamic` defers member lookup to run time.",
      "example": "Prefer `Deserialize<AuthToken>` over `dynamic` JSON.",
      "topicSlug": "object-cts-dynamic"
    }
  ],
  "revisionDiagram": {
    "type": "mermaid",
    "title": "C# type system concept map",
    "source": "mindmap\n  root((C# Type System))\n    Inference\n      var keyword\n      static type locked\n    Built-ins\n      int long decimal\n      bool char string\n    Semantics\n      value copy\n      reference alias\n      boxing to object\n    Safety\n      definite assignment\n      int? nullable struct\n      null on references\n    Operations\n      implicit widening\n      explicit cast\n      is as typeof\n    Custom types\n      class struct\n      record enum\n      interface tuple generic\n    CTS\n      object root\n      dynamic late bind"
  }
}
