{
  "moduleId": "dotnet-11-observability-and-health",
  "title": "Observability and health — concept map",
  "intro": "Observability answers three questions about your Web API in production: what happened (structured logs), how fast (metrics), and where time was spent (distributed traces). This module covers ILogger with log scopes, OpenTelemetry tracing and metrics, dotnet-counters for live diagnosis, Kubernetes health probes (liveness vs readiness), correlation IDs across microservices, and Application Insights on Azure.",
  "overviewDiagram": {
    "type": "mermaid",
    "title": "Observability pillars for ASP.NET Core APIs",
    "source": "flowchart TD\n  Request[HTTP Request] --> MW[Correlation middleware BeginScope]\n  MW --> Handler[Controller or Minimal API]\n  Handler --> Logs[ILogger structured logs]\n  Handler --> Traces[OpenTelemetry Activity spans]\n  Handler --> Metrics[Meters counters histograms]\n  Handler --> Deps[HttpClient SQL Redis]\n  Deps --> Traces\n  Logs --> Export[OTLP App Insights Seq]\n  Traces --> Export\n  Metrics --> Export\n  Export --> Dash[Grafana App Insights KQL]\n  Probe[K8s liveness readiness] --> Health[MapHealthChecks tagged endpoints]"
  },
  "conceptCards": [
    {
      "id": "card-structured-logging",
      "title": "Structured logging",
      "summary": "ILogger message templates not interpolation. BeginScope for CorrelationId and OrderId. Tune LogLevel per namespace. Serilog or OTel log export.",
      "example": "LogInformation(\"Order {OrderId} created\", id)",
      "topicSlug": "structured-logging"
    },
    {
      "id": "card-otel-tracing",
      "title": "OpenTelemetry tracing",
      "summary": "Activity spans with trace id. AddAspNetCoreInstrumentation + HttpClientInstrumentation. traceparent propagation across microservices. Custom ActivitySource.",
      "example": "AddOtlpExporter to Jaeger or App Insights",
      "topicSlug": "opentelemetry-tracing"
    },
    {
      "id": "card-metrics",
      "title": "Metrics and dotnet-counters",
      "summary": "Counters histograms via System.Diagnostics.Metrics. RED method Rate Errors Duration. dotnet-counters for thread pool GC live. Prometheus scrape.",
      "example": "dotnet-counters monitor -n Api --counters System.Runtime",
      "topicSlug": "metrics-and-counters"
    },
    {
      "id": "card-health",
      "title": "Health checks K8s probes",
      "summary": "Liveness restarts pod self-check only. Readiness removes from LB when DB down. startupProbe for migrations. Tags live and ready.",
      "example": "/health/live vs /health/ready",
      "topicSlug": "health-checks"
    },
    {
      "id": "card-correlation",
      "title": "Correlation IDs",
      "summary": "X-Correlation-Id middleware. DelegatingHandler forwards to HttpClient. Problem Details extension. Queue message properties.",
      "example": "Search one id in App Insights across services",
      "topicSlug": "correlation-ids"
    },
    {
      "id": "card-appinsights",
      "title": "Application Insights",
      "summary": "UseAzureMonitor OTel exporter. operation_Id links request and dependencies. KQL joins for slow endpoints. Adaptive sampling.",
      "example": "requests join dependencies on operation_Id",
      "topicSlug": "application-insights"
    }
  ],
  "revisionDiagram": {
    "type": "mermaid",
    "title": "Observability module revision map",
    "source": "mindmap\n  root((Observability Module 11))\n    Structured Logging\n      ILogger T injection\n      Message templates not interpolation\n      BeginScope CorrelationId\n      LogLevel appsettings tuning\n      Serilog JsonFormatter\n      Never log PII tokens\n    OpenTelemetry Tracing\n      Activity and ActivitySource\n      traceparent W3C propagation\n      AddAspNetCoreInstrumentation\n      AddHttpClientInstrumentation\n      Custom spans SetTag\n      OTLP exporter sampling\n      Filter health endpoints\n    Metrics Counters\n      System.Diagnostics.Metrics\n      Counter vs Histogram\n      dotnet-counters monitor\n      threadpool-queue-length\n      gen-2-gc-count starvation\n      Prometheus RED method\n      p95 not average\n    Health Checks K8s\n      IHealthCheck AddHealthChecks\n      Liveness restart pod\n      Readiness remove from LB\n      startupProbe migrations\n      Tags live vs ready\n      AllowAnonymous probes\n      Never DB on liveness\n    Correlation IDs\n      X-Correlation-Id header\n      Middleware early pipeline\n      DelegatingHandler HttpClient\n      Problem Details extension\n      Message queue propagation\n      Align with trace id\n    Application Insights\n      UseAzureMonitor OTel\n      operation_Id transaction view\n      Dependency telemetry SQL HTTP\n      KQL slow request join\n      cloud_RoleName per service\n      Adaptive sampling cost"
  }
}
