{
  "moduleId": "aws-07-perimeter-and-gateways",
  "title": "Perimeter and gateways — concept map",
  "intro": "The network perimeter controls who reaches your workloads. Security groups are stateful Elastic Network Interface (ENI) firewalls. Network Access Control Lists (NACLs) are stateless subnet boundaries with deny rules. Application Load Balancer (ALB), Network Load Balancer (NLB), and Gateway Load Balancer (GWLB) route traffic at different OSI layers. API Gateway fronts serverless APIs. AWS WAF and Shield harden the HTTP edge. The full request path ties every hop from client to target.",
  "overviewDiagram": {
    "type": "mermaid",
    "title": "Perimeter stack",
    "source": "flowchart TB\n  Client[Internet client] --> CF[CloudFront optional]\n  CF --> WAF[AWS WAF]\n  WAF --> Edge[ALB or API Gateway]\n  Edge --> SG1[Edge security group]\n  SG1 --> TG[Target group]\n  TG --> SG2[Target security group]\n  SG2 --> App[EC2 / ECS / Lambda]\n  NACL[NACL subnet boundary] -.-> Edge\n  NACL -.-> App"
  },
  "conceptCards": [
    {
      "id": "card-sg",
      "title": "Security groups",
      "summary": "Stateful ENI firewall. Allow-only. SG-to-SG for ALB→target tiers.",
      "example": "App SG allows tcp/8080 from ALB SG only",
      "topicSlug": "security-groups"
    },
    {
      "id": "card-nacl",
      "title": "Network ACLs",
      "summary": "Stateless subnet filter. Numbered allow/deny. Ephemeral return rules needed.",
      "example": "Deny known bad CIDR at rule 50",
      "topicSlug": "network-acls"
    },
    {
      "id": "card-lb",
      "title": "ALB / NLB / GWLB",
      "summary": "L7 HTTP vs L4 TCP/static IP vs L3 inline inspection.",
      "example": "PrivateLink provider NLB; web API on ALB",
      "topicSlug": "alb-nlb-gwlb"
    },
    {
      "id": "card-apigw",
      "title": "API Gateway",
      "summary": "HTTP API for most Lambda REST. REST API for usage plans. WebSocket for live.",
      "example": "POST /orders → Lambda proxy integration",
      "topicSlug": "api-gateway"
    },
    {
      "id": "card-waf",
      "title": "WAF & Shield",
      "summary": "WAF = L7 rules. Shield Standard free DDoS. Advanced = DRT + cost protection.",
      "example": "Managed OWASP rule set on CloudFront",
      "topicSlug": "waf-shield"
    },
    {
      "id": "card-path",
      "title": "Full request path",
      "summary": "Route53 → CloudFront → WAF → ALB → SG chain → target. Debug per hop.",
      "example": "502 with healthy app → target SG blocks ALB",
      "topicSlug": "full-request-path"
    }
  ],
  "revisionDiagram": {
    "type": "mermaid",
    "title": "Perimeter revision map",
    "source": "mindmap\n  root((Perimeter))\n    Security groups\n      Stateful ENI\n      Allow only\n      SG to SG tiers\n    NACLs\n      Stateless subnet\n      Rule number order\n      Explicit deny\n      Ephemeral outbound\n    Load balancers\n      ALB L7 HTTP\n      NLB L4 TCP static IP\n      GWLB L3 inspection\n    API Gateway\n      HTTP API v2 default\n      REST usage plans\n      WebSocket routes\n    WAF Shield\n      Web ACL rules\n      Shield Standard free\n      Shield Advanced DRT\n    Request path\n      Route53 DNS\n      CloudFront edge\n      WAF filter\n      ALB target health\n      Dual SG chain"
  }
}
