{
  "moduleId": "aws-14-cloudwatch-observability",
  "title": "CloudWatch observability — concept map",
  "intro": "Observability on AWS starts with CloudWatch metrics (what is happening), Logs (why it happened), and Alarms (tell humans when to act). AWS X-Ray adds distributed tracing across Lambda, API Gateway, and downstream calls. For the Lambda-plus-SQS stack, a structured debug runbook ties queue depth, error rates, log patterns, and trace IDs into a repeatable on-call workflow.",
  "overviewDiagram": {
    "type": "mermaid",
    "title": "Observability signal flow",
    "source": "flowchart LR\n  APP[Lambda / ECS / API] -->|PutMetricData| CW[CloudWatch Metrics]\n  APP -->|stdout stderr| LOGS[CloudWatch Logs]\n  APP -->|X-Ray SDK| XR[AWS X-Ray]\n  CW --> ALARM[CloudWatch Alarms]\n  LOGS --> INSIGHTS[Logs Insights]\n  ALARM --> SNS[SNS / PagerDuty]\n  XR --> MAP[Service map trace]"
  },
  "conceptCards": [
    {
      "id": "card-metrics",
      "title": "Metrics",
      "summary": "Namespace + metric name + dimensions. Custom metrics via PutMetricData. EMF for Lambda auto-extract.",
      "example": "OrdersProcessed with dimension Environment=prod",
      "topicSlug": "cloudwatch-metrics"
    },
    {
      "id": "card-logs",
      "title": "Logs",
      "summary": "Log group per service; streams per instance. Insights queries with filter and stats.",
      "example": "fields @timestamp, @message | filter errorCode = 'Timeout'",
      "topicSlug": "cloudwatch-logs"
    },
    {
      "id": "card-alarms",
      "title": "Alarms",
      "summary": "Metric math, composite alarms, anomaly detection. Alarm on symptoms not every blip.",
      "example": "AgeOfOldestMessage > 300s for 3 consecutive periods",
      "topicSlug": "cloudwatch-alarms"
    },
    {
      "id": "card-xray",
      "title": "X-Ray",
      "summary": "Trace ID propagates across services. Subsegments for DB and HTTP calls.",
      "example": "Lambda cold start visible as init subsegment duration",
      "topicSlug": "xray-tracing"
    },
    {
      "id": "card-runbook",
      "title": "Debug runbook",
      "summary": "Queue depth → Lambda errors → DLQ → logs → trace. Ordered checklist for on-call.",
      "example": "ApproximateAgeOfOldestMessage spike → check Errors metric → Logs Insights",
      "topicSlug": "lambda-sqs-debug-runbook"
    }
  ],
  "revisionDiagram": {
    "type": "mermaid",
    "title": "Observability revision map",
    "source": "mindmap\n  root((Observability))\n    Metrics\n      Built-in AWS namespaces\n      Custom PutMetricData\n      Dimensions cardinality cost\n      EMF embedded metric format\n    Logs\n      Groups streams retention\n      Logs Insights query\n      Subscription filters\n      Metric filters from logs\n    Alarms\n      Threshold composite anomaly\n      OK ALARM INSUFFICIENT_DATA\n      SNS PagerDuty integration\n    X-Ray\n      Trace segment subsegment\n      Service map propagation\n      Sampling rules cost\n    Runbook\n      SQS age depth DLQ\n      Lambda errors throttles\n      VPC ENI cold start\n      Correlation trace ID in logs"
  }
}
