{
  "moduleId": "typescript-14-modules-and-declarations",
  "title": "Module resolution and declaration files — concept map",
  "intro": "moduleResolution, paths, ambient declarations, .d.ts files, declare module, triple-slash directives, and typing JS libraries.",
  "overviewDiagram": {
    "type": "mermaid",
    "title": "Module resolution and declaration files overview",
    "source": "flowchart TD\n  M[Module resolution and declaration files] --> T1[Topic 1]\n  M --> T2[Topic 2]\n  M --> T3[Topic 3]\n  T1 --> P[Practice + interview]"
  },
  "conceptCards": [
    {
      "id": "card-module-resolution-modes",
      "title": "Module resolution: node, bundler, and nodenext",
      "summary": "Module resolution: node, bundler, and nodenext governs how code is loaded, tree-shaken, and resolved at build time versus run time.",
      "example": "import { readFile } from 'node:fs/promises';",
      "topicSlug": "module-resolution-modes"
    },
    {
      "id": "card-path-mapping",
      "title": "paths, baseUrl, and import aliases",
      "summary": "paths, baseUrl, and import aliases governs how code is loaded, tree-shaken, and resolved at build time versus run time.",
      "example": "import { readFile } from 'node:fs/promises';",
      "topicSlug": "path-mapping"
    },
    {
      "id": "card-ambient-declarations",
      "title": "Ambient declarations and declare global",
      "summary": "Ambient declarations and declare global differs between browser and Node.js hosts.",
      "example": "const fetchFn = globalThis.fetch;",
      "topicSlug": "ambient-declarations"
    },
    {
      "id": "card-typing-javascript-libraries",
      "title": "Typing JavaScript libraries (@types and hand-written .d.ts)",
      "summary": "Typing JavaScript libraries (@types and hand-written .d.ts) is where JavaScript dynamic typing surprises C# developers — implicit ToNumber, ToString, and truthiness rules that =...",
      "example": "interface Config {",
      "topicSlug": "typing-javascript-libraries"
    },
    {
      "id": "card-declare-module-augmentation",
      "title": "declare module and module augmentation",
      "summary": "declare module and module augmentation governs how code is loaded, tree-shaken, and resolved at build time versus run time.",
      "example": "import { readFile } from 'node:fs/promises';",
      "topicSlug": "declare-module-augmentation"
    }
  ],
  "revisionDiagram": {
    "type": "mermaid",
    "title": "Module resolution and declaration files revision map",
    "source": "mindmap\n  root((Module resolution and declaration files))\n    module_resolution_modes[Module resolution: node, bundler, and nodenext]\n    path_mapping[paths, baseUrl, and import aliases]\n    ambient_declarations[Ambient declarations and declare global]\n    typing_javascript_libraries[Typing JavaScript libraries (@types and hand-written .d.ts)]\n    declare_module_augmentation[declare module and module augmentation]"
  }
}
